{
  "title":"Landtagswahl Mecklenburg-Vorpommern",
  "date":"2021-09-26",
  "info":"https://de.wikipedia.org/wiki/Landtagswahl_in_Mecklenburg-Vorpommern_2021",
  "slug":"mecklenburgvorpommern2021",
  "data_source":"https://www.wahl-o-mat.de/mecklenburgvorpommern2021/PositionsVergleichMecklenburgVorpommern2021.pdf"
}
