{
  "title":"Landtagswahl Nordrhein-Westfalen",
  "date":"2022-05-15",
  "info":"https://de.wikipedia.org/wiki/Landtagswahl_in_Nordrhein-Westfalen_2022",
  "slug":"nordrheinwestfalen2022",
  "data_source":"https://www.wahl-o-mat.de/nordrheinwestfalen2022/PositionsVergleichNordrheinWestfalen2022.pdf"
}
